"Front","Back"
"什么是超参数 (Hyperparameter)？","超参数是在开始学习过程之前设置的参数，而不是通过训练得到的参数。它们用于控制学习过程本身。例如：学习率、神经网络的层数和隐藏单元数、正则化参数等。"
"超参数和模型参数 (Model Parameter) 有什么区别？","**超参数**由数据科学家手动设置，用于配置模型和控制训练过程。**模型参数**是模型在训练过程中自动学习的变量，例如神经网络的权重和偏置。模型参数是模型内部的，而超参数是模型外部的。"
"什么是网格搜索 (Grid Search)？","网格搜索是一种超参数调优方法。它通过遍历所有给定的超参数值的组合来穷举搜索，为每个组合训练一个模型，并使用交叉验证评估性能，最终选择性能最好的超参数组合。"
"网格搜索有什么缺点？","当超参数数量较多或每个超参数的取值范围较大时，网格搜索的计算成本会呈指数级增长，变得非常耗时。此外，它可能会在不重要的超参数上浪费大量时间。"
"什么是随机搜索 (Random Search)？","随机搜索也是一种超参数调优方法。与网格搜索不同，它不是尝试所有组合，而是在给定的参数空间中随机采样指定数量的组合。实践证明，随机搜索通常比网格搜索更高效，因为重要的超参数更有可能被好的值命中。"
"什么是贝叶斯优化 (Bayesian Optimization)？","贝叶斯优化是一种更智能的超参数调优方法。它利用先前评估过的超参数组合的性能信息，来构建一个关于目标函数（如模型性能）的概率模型。然后，它使用这个模型来选择下一个最有希望提升性能的超参数组合进行评估。这种方法通常比网格搜索和随机搜索需要更少的评估次数。"
"为什么超参数调优很重要？","超参数的选择对模型的性能有至关重要的影响。一组好的超参数可以显著提升模型的准确率和泛化能力，而一组差的超参数可能导致模型不收敛、过拟合或欠拟合。"
"在超参数调优中，交叉验证 (Cross-Validation) 的作用是什么？","交叉验证用于更稳健地评估一组超参数的性能。它将训练数据分成多个子集（折），轮流使用其中一个子集作为验证集，其余作为训练集。通过对多次评估结果取平均，可以减少因数据划分偶然性带来的评估偏差，从而更可靠地选择最佳超参数。"
