"Front","Back","TAGS"
"What is PyTorch?","PyTorch is a popular open-source deep learning framework known for its flexibility and ease of use. It's especially favored in the research community for its 'Pythonic' feel and intuitive way of building and experimenting with models.","PyTorch"
"What is a Tensor in PyTorch?","A Tensor is the fundamental data structure in PyTorch, similar to a NumPy array. However, unlike NumPy arrays, Tensors can be moved to a GPU for massive parallel computation, and they can automatically track their history of operations to calculate gradients for model training (autograd).","PyTorch"
"What does it mean that PyTorch uses a 'dynamic computation graph'?","It means the network's structure is defined on the fly, as the code runs. This is like building a LEGO model without instructions; you can change your mind and add or remove pieces at any step. This provides immense flexibility for debugging and for building complex models with dynamic structures (like RNNs). This is also known as a 'Define-by-Run' approach.","PyTorch"
"What is the purpose of `autograd` in PyTorch?","`autograd` is PyTorch's automatic differentiation engine. It's the magic that calculates the gradients (slopes) needed for backpropagation. When you perform operations on tensors, `autograd` builds a graph of these operations. Calling `.backward()` on the final loss automatically computes the gradients for all model parameters, which are then used by the optimizer to update the model.","PyTorch"
"What is the role of `nn.Module` in PyTorch?","`nn.Module` is the base class for all neural network modules in PyTorch. When you build a custom model, you create a class that inherits from `nn.Module`. This gives you access to critical functionalities, like automatically tracking all the model's learnable parameters (`.parameters()`) and easily switching between training and evaluation modes (`.train()` and `.eval()`).","PyTorch"
"What is the standard training loop in PyTorch?","The standard loop for one epoch involves these key steps: 1. Get a batch of data. 2. Make a forward pass through the model to get predictions. 3. Calculate the loss (error). 4. Zero out old gradients (`optimizer.zero_grad()`). 5. Perform backpropagation to calculate new gradients (`loss.backward()`). 6. Update the model's weights (`optimizer.step()`).","PyTorch"
